{
  "actor_id": "player-a",
  "payload": {
    "charge_target_unit_instance_ids": [
      "army-beta:intercessor-unit-2"
    ],
    "movement_mode": "charge",
    "movement_phase_action": "charge_move",
    "proposal_kind": "charge_move",
    "proposal_request_id": "ui-contract-charge-move-request-000001",
    "unit_instance_id": "army-alpha:intercessor-unit-1",
    "witness": {
      "model_paths": [
        {
          "model_id": "army-alpha:intercessor-unit-1:core-intercessor-like:001",
          "poses": [
            {
              "facing": {
                "degrees": 0.0
              },
              "position": {
                "x": 30.0,
                "y": 12.0,
                "z": 0.0
              }
            },
            {
              "facing": {
                "degrees": 0.0
              },
              "position": {
                "x": 36.0,
                "y": 12.0,
                "z": 0.0
              }
            }
          ]
        }
      ]
    }
  },
  "result_id": "phase18d-charge_move-result-000001",
  "schema_version": "parameterized-submission-v2-weapon-instances"
}
