{
  "actor_id": "player-a",
  "payload": {
    "movement_mode": "pile_in",
    "movement_phase_action": "pile_in",
    "pile_in_target_unit_instance_ids": [],
    "proposal_kind": "pile_in",
    "proposal_request_id": "contract-pile-in-request-000001",
    "unit_instance_id": "army-alpha:unit-1"
  },
  "result_id": "phase18d-pile_in-result-000001",
  "schema_version": "parameterized-submission-v2-weapon-instances"
}
