{
  "actor_id": "player-a",
  "payload": {
    "movement_mode": "surge_move",
    "movement_phase_action": "surge_move",
    "proposal_kind": "surge_move",
    "proposal_request_id": "contract-surge-request-000001",
    "unit_instance_id": "army-alpha:unit-1",
    "witness": {
      "model_paths": []
    }
  },
  "result_id": "phase18d-surge_move-result-000001",
  "schema_version": "parameterized-submission-v2-weapon-instances"
}
