{
  "actor_id": "player-a",
  "payload": {
    "attempted_placement": {
      "army_id": "army-alpha",
      "model_placements": [
        {
          "army_id": "army-alpha",
          "model_instance_id": "army-alpha:unit-1:model-1",
          "player_id": "player-a",
          "pose": {
            "facing": {
              "degrees": 0.0
            },
            "position": {
              "x": 12.0,
              "y": 18.0,
              "z": 0.0
            }
          },
          "unit_instance_id": "army-alpha:unit-1"
        }
      ],
      "player_id": "player-a",
      "unit_instance_id": "army-alpha:unit-1"
    },
    "placement_kind": "cult_ambush",
    "proposal_kind": "cult_ambush_placement",
    "proposal_request_id": "contract-cult-ambush-request-000001",
    "unit_instance_id": "army-alpha:unit-1"
  },
  "result_id": "phase18d-cult_ambush_placement-result-000001",
  "schema_version": "parameterized-submission-v2-weapon-instances"
}
